<?xml version="1.0" encoding="UTF-8"?>
<OSDSpec xmlns:xsi="http://www.w3.org/2001/XMLSchema-instance"
	xsi:noNamespaceSchemaLocation="file:/C:/Development/Eclipse_Worksp/Eclipse_Worksp4.2.2/OpenIoT/GitHub/ait-develop/openiot/utils/openIotCommons/src/main/resources/OSDSpec/OSDSpec.xsd"
	userID="nodeID://b46876">
	<OAMO id="OpenIoTApplicationModelObject1ID" name="OpenIoTApplicationModelObject1Name">
		<description>OpenIoTApplicationModelObject1Descreption</description>
		<OSMO name="only one oamo test osmo_name">
			<description>only one oamo test osmo_description</description>
			<queryControls>
				<QuerySchedule>
					<second>M9y7aLQSxSj3s-NiLVNoDgz</second>
					<minute>vuL0v.3s_jsB</minute>
					<hour>qbBht_g</hour>
					<dayOfMonth>K5dKF-Vki7X</dayOfMonth>
					<month>CZw9WuVoztWeN1lV7Q-rOckNZR</month>
					<dayOfWeek>Yvz_omXZU7yTpPa1V8NiSqaL</dayOfWeek>
				</QuerySchedule>
				<trigger>http://vyfDxLWN/</trigger>
				<initialRecordTime>2013-11-20T22:54:08</initialRecordTime>
				<reportIfEmpty>true</reportIfEmpty>
			</queryControls>
			<requestPresentation>
				<widget widgetID="nodeID://b44801">
					<presentationAttr name="widget b44801 attr1"
						value="widget b44801 value1 " />
					<presentationAttr name="widget b44801 attr2"
						value="widget b44801 value2" />
				</widget>
				<widget widgetID="nodeID://b44790">
					<presentationAttr name="widget b44790 attr1"
						value="widget b44790 value1" />
					<presentationAttr name="widget b44790 attr2"
						value="widget b44790 value2" />
				</widget>
			</requestPresentation>
			<query-request>
				<query>SELECT * FROM #openiot# WHERE {?s ?p ?o}</query>
				<default-graph-uri>http://AaQuDPSJ/</default-graph-uri>
				<named-graph-uri>http://kHGZizGZ/</named-graph-uri>
				<dynamicAttrMaxValue name="HMIJ_yAks5E"
					value="_kKKOBxL4fMVWVN.yW0CM0v" />
				<dynamicAttrMaxValue name="JEOs6Rt"
					value="P4yO.t2R0ky5V2Vo9shr-dkgC" />
				<dynamicAttrMaxValue name="khsITns1Dj.m5Di.c"
					value="dizQ.h2cLctlMQuB7tAEBpmxWi" />
			</query-request>
		</OSMO>
	</OAMO>
</OSDSpec>
